{"$schema":"https://json-schema.org/draft/2020-12/schema","$id":"https://openform.dev/spec/record-v1.schema.json","title":"OpenForm Record v1","type":"object","additionalProperties":false,"required":["spec","id","definition","created_at","updated_at","data"],"properties":{"spec":{"const":"openform/record/v1"},"id":{"type":"string","pattern":"^rec_[A-Za-z0-9_-]+$"},"definition":{"type":"object","additionalProperties":false,"required":["id","version"],"properties":{"id":{"type":"string","pattern":"^[a-z][a-z0-9_]*$"},"version":{"type":"integer","minimum":1}}},"created_at":{"type":"string","format":"date-time"},"updated_at":{"type":"string","format":"date-time"},"data":{"type":"object"}}}
