{
  "spec": "openform/record/v1",
  "id": "rec_example_workout",
  "definition": {
    "id": "workout",
    "version": 2
  },
  "created_at": "2026-09-12T05:10:00.000Z",
  "updated_at": "2026-09-12T05:10:00.000Z",
  "data": {
    "workout_date": "2026-09-12",
    "body_weight": 94.5,
    "exercises": [
      {
        "name": "Back Squat",
        "form_video": "https://example.invalid/openform/back-squat.mp4",
        "sets": [
          { "load": 80, "reps": 8, "rpe": 7 },
          { "load": 85, "reps": 8, "rpe": 8 },
          { "load": 85, "reps": 6, "rpe": 9 }
        ]
      },
      {
        "name": "Romanian Deadlift",
        "form_video": "",
        "sets": [
          { "load": 70, "reps": 10, "rpe": 8 }
        ]
      }
    ]
  }
}
