{
  "spec": "openform/record/v1",
  "id": "rec_example_inspection",
  "definition": {
    "id": "inspection",
    "version": 1
  },
  "created_at": "2026-09-12T05:20:00.000Z",
  "updated_at": "2026-09-12T05:20:00.000Z",
  "data": {
    "inspected_at": "2026-09-12T13:20",
    "location": "22.6273,120.3014",
    "status": "attention",
    "issue_description": "Cable routing should be secured before handover.",
    "photo": "https://example.invalid/openform/inspection.jpg"
  }
}
